{
  "draft_version": "1.0.0",
  "job_id": "job_01",
  "run_id": "run_20260717T010203Z_0123456789abcdef",
  "revision": 2,
  "answer_blocks": [
    {
      "block_id": "block_01",
      "support_status": "supported",
      "text_template": "매출총이익률은 {{value:value_01}}입니다.",
      "value_refs": [
        "value_01"
      ],
      "claim_refs": [
        "claim_01"
      ],
      "evidence_link_ids": [
        "evidence_01"
      ],
      "source_refs": [
        "source_01"
      ]
    }
  ]
}
